{
  "cme_id": "CME-405",
  "control_name": "DNSSEC Validation",
  "description": "Validates DNS responses using cryptographic signatures, preventing DNS spoofing, cache poisoning, and DNS-based redirection attacks.",
  "tactic": "Harden",
  "category": "Cryptographic Controls",
  "control_layer": "Network",
  "cvss_vector_impacts": [
    {
      "metric": "AC",
      "from": "L",
      "to": "H",
      "rationale": "DNS-based redirect/spoofing attacks require breaking DNSSEC chain of trust"
    }
  ],
  "cwe_relationships": [
    "CWE-350"
  ],
  "verification": {
    "method": "Verify DNSSEC validation is enabled in resolver",
    "commands": [
      {
        "command": "resolvectl status | grep DNSSEC",
        "expected": "DNSSEC setting: yes",
        "platform": "linux"
      },
      {
        "command": "grep 'val-permissive-mode' /etc/unbound/unbound.conf",
        "expected": "val-permissive-mode: no",
        "platform": "linux"
      }
    ]
  },
  "confidence": "High",
  "platforms": [
    "RHEL 9",
    "Ubuntu 24.04"
  ]
}
