{
  "cme_id": "CME-110",
  "control_name": "KEXEC Restriction",
  "description": "Prevents loading a new kernel at runtime via kexec, blocking a vector for kernel-level persistence and Secure Boot bypass.",
  "tactic": "Harden",
  "category": "Kernel Hardening",
  "control_layer": "OS/Kernel",
  "cvss_vector_impacts": [
    {
      "metric": "AC",
      "from": "L",
      "to": "H",
      "rationale": "Cannot replace running kernel to bypass security controls"
    }
  ],
  "cwe_relationships": [
    "CWE-269"
  ],
  "verification": {
    "method": "Check kexec_load_disabled sysctl",
    "commands": [
      {
        "command": "cat /proc/sys/kernel/kexec_load_disabled",
        "expected": "1",
        "platform": "linux"
      }
    ]
  },
  "confidence": "High",
  "platforms": [
    "RHEL 9",
    "RHEL 8",
    "Ubuntu 24.04"
  ]
}
